city,description
Arba Minch,Nechisar National Park
Arba Minch,Crocodile Market
Arba Minch,Chamo Lake
Arba Minch,Abaya Lake
Arba Minch,Dorze Village
Arba Minch,Konso Cultural Landscape
Arba Minch,Arba Minch Forest
Arba Minch,Forty Springs
Arba Minch,Traditional Dorze Weaving
Arba Minch,Boat Tours on Chamo Lake
Arba Minch,Bird Watching at Nechisar
Arba Minch,Arba Minch Market
Arba Minch,Local Cuisine and Traditional Dishes
Arba Minch,Exploring Local Cafes and Restaurants
Arba Minch,Participating in Traditional Coffee Ceremonies
Arba Minch,Shopping for Local Handicrafts and Souvenirs
Arba Minch,Hiking and Nature Trails
Arba Minch,Exploring Nearby Villages and Communities
Arba Minch,Photographing Scenic Landscapes and Wildlife
Arba Minch,Attending Local Cultural Events and Performances
Arba Minch,Visiting Archaeological Sites and Historical Landmarks
Arba Minch,Guided Tours of Nechisar National Park
Arba Minch,Boat Rides to See Hippos and Crocodiles
Arba Minch,Fishing in Chamo and Abaya Lakes
Arba Minch,Exploring the Scenic Views from Kulfo River
Arba Minch,Cultural Dance Performances in Dorze Village
Arba Minch,Traditional Dorze House Tours
Arba Minch,Visiting the Weekly Markets
Arba Minch,Tasting Fresh Fish Dishes from Chamo Lake
Arba Minch,Exploring the Konso Cultural Heritage
Arba Minch,Relaxing at Local Resorts and Lodges
Arba Minch,Joining Ecotourism Activities
Arba Minch,Learning about Local Flora and Fauna
Arba Minch,Participating in Community-Based Tourism
Arba Minch,Exploring Historical and Cultural Museums
Arba Minch,Experiencing Local Festivals and Celebrations
Arba Minch,Boat Excursions for Bird Watching
Arba Minch,Exploring Hot Springs in the Area
Arba Minch,Engaging with Local Artisans and Craftsmen
Arba Minch,Visiting the Scenic Waterfalls Near Arba Minch
Arba Minch,Joining Conservation and Wildlife Protection Projects
Arba Minch,Exploring the Coffee Plantations
Arba Minch,Learning Traditional Cooking Techniques
Arba Minch,Participating in Local Storytelling and Folklore Events
Arba Minch,Swimming in Natural Pools
Arba Minch,Camping in Nechisar National Park
Arba Minch,Kayaking on Chamo Lake
Arba Minch,Mountain Biking in Surrounding Hills
Arba Minch,Participating in Traditional Music and Dance Workshops
Arba Minch,Exploring Rock Formations and Caves
Arba Minch,Visiting Local Farms and Learning About Agriculture
Arba Minch,Stargazing in Clear Night Skies
Arba Minch,Joining Guided Nature Walks
Arba Minch,Participating in Local Festivals and Ceremonies
Arba Minch,Taking Cooking Classes to Learn Local Recipes
Arba Minch,Exploring Art Galleries and Local Artist Studios
Arba Minch,Joining Wildlife Photography Tours
Arba Minch,Exploring Hidden Trails and Secret Spots
Arba Minch,Joining Volunteer Programs and Community Projects
Arba Minch,Attending Local Storytelling Sessions
Arba Minch,Exploring Ancient Ruins and Historical Sites
Arba Minch,Learning About Local Herbal Medicine and Remedies
Arba Minch,High Temrature hot temrature
Arba Minch,Small Village Dorze Village
