City,Description
Axum,Cultural Festival
Axum,Stele Park
Axum,Obelisks of Axum
Axum,King Ezana's Inscriptions
Axum,Axum Archaeological Museum
Axum,Dungur Palace
Axum,Church of St. Mary of Zion
Axum,Queen of Sheba's Palace
Axum,Axumite Baths
Axum,Great Stelae Field
Axum,House of the Ark of the Covenant
Axum,The Chapel of the Tablet
Axum,Axum Obelisk (Rome)
Axum,Ruins of Ancient Axum
Axum,Axumite Heritage Park
Axum,Monastery of Abba Pantaleon
Axum,Axum Tsion Mariam Church
Axum,Chapel of the Tablet
Axum,Ruins of Queen Sheba
Axum,St. Mary of Zion Cathedral
Axum,Ark of the Covenant
Axum,Queen Sheba Palace
Axum,Queen of Sheba's Palace
Axum,Queen of Sheba museum
Axum,Axumite cuisine and traditional dishes
Axum,Exploring local markets and food stalls
Axum,Participating in traditional coffee ceremonies
Axum,Visiting local cafes and restaurants
Axum,Shopping for local handicrafts and souvenirs
Axum,Hiking and nature trails around Axum
Axum,Exploring nearby villages and communities
Axum,Photographing the scenic landscapes and historical sites
Axum,Attending local cultural events and performances
Axum,Visiting archaeological sites and ruins
Axum,Guided tours of historical landmarks
Axum,Enjoying moderate temperatures year-round 20°C - 25°C
