city,description
Gondar,Royal Enclosure - Fasil Ghebbi
Gondar,Debre Berhan Selassie Church
Gondar,Bath of Fasiladas
Gondar,Fasilides Castle
Gondar,Qusquam Complex
Gondar,Falasha Village
Gondar,Visiting Local Markets in Gondar
Gondar,Tasting Traditional Ethiopian Cuisine
Gondar,Exploring Local Arts and Crafts
Gondar,Attending Cultural Festivals and Events
Gondar,Hiking in the Semien Mountains
Gondar,Visiting Local Educational Institutions
Gondar,Attending Religious Ceremonies and Services
Gondar,Exploring Gondar Museum
Gondar,Shopping for Handicrafts and Souvenirs
Gondar,Participating in Guided Tours of Gondar Historical Sites
Gondar,Staying in Traditional Guesthouses or Hotels
Gondar,Attending Community Gatherings and Meetings
Gondar,Visiting Ancient Monasteries
Gondar,Engaging with Local Community Leaders
Gondar,Participating in Village Life Activities
Gondar,Experiencing Traditional Ethiopian Music and Dance
Gondar,Observing Ritual Practices
Gondar,Photographing Historical Architecture
Gondar,Engaging in Environmental Conservation Efforts
Gondar,Exploring the Natural Beauty of the Region
Gondar,Participating in Wildlife Conservation Programs
Gondar,Attending Local Sports Events
Gondar,Relaxing at Scenic Locations
Gondar,Stargazing and Night Sky Observation
Gondar,Participating in Bird Watching Tours
Gondar,Visiting Historical Sites and Monuments
Gondar,Learning About Archaeological Studies in Gondar
Gondar,Supporting Local Economic Initiatives
Gondar,Engaging in Sustainable Tourism Practices
Gondar,Exploring Nearby National Parks and Reserves
