city,description
Kafa,Explore the birthplace of coffee.
Kafa,Visit the Kafa Biosphere Reserve.
Kafa,Experience coffee plantation tours.
Kafa,Learn about traditional coffee processing methods.
Kafa,Hike through lush montane forests.
Kafa,Spot diverse bird species in their natural habitat.
Kafa,Enjoy guided nature walks.
Kafa,Discover local flora and fauna.
Kafa,Visit traditional Ethiopian villages.
Kafa,Experience the rich cultural heritage of the region.
Kafa,Participate in coffee tasting sessions.
Kafa,Learn about the history and culture of coffee.
Kafa,Explore the beautiful landscapes and waterfalls.
Kafa,Engage in community-based tourism.
Kafa,Visit the Kafa Coffee Museum.
Kafa,Enjoy local Ethiopian cuisine.
Kafa,Stay in eco-friendly lodges.
Kafa,Participate in conservation activities.
Kafa,Join guided tours of the biosphere reserve.
Kafa,Experience traditional Ethiopian music and dance.
Kafa,Learn about sustainable coffee farming practices.
Kafa,Photograph stunning natural scenery.
Kafa,Relax in the peaceful environment.
Kafa,Visit local markets for handmade crafts.
Kafa,Join birdwatching excursions.
Kafa,Explore nearby caves and rock formations.
Kafa,Participate in eco-tourism activities.
Kafa,Take part in educational programs on biodiversity.
Kafa,Enjoy picnics in scenic spots.
Kafa,Learn about medicinal plants from local guides.
Kafa,Engage in hiking and trekking adventures.
Kafa,Experience local festivals and cultural events.
Kafa,Interact with local communities and learn their traditions.
Kafa,Explore ancient sites and historical landmarks.
Kafa,Experience the serene beauty of the natural surroundings.
Kafa,Join wellness and relaxation activities.
Kafa,Take part in tree planting and reforestation projects.
Kafa,Enjoy the fresh air and scenic views.
